{
  "$comment": "chwezi-slop rule registry (M10-09-T01). Data rows keyed to the K5 AS1-AS7 overlay. Enforces Chwezi doctrine, not Impeccable's: Impeccable rule ideas and thresholds are adapted in paraphrase with attribution (Apache-2.0, commit 114ea1d) and its font lists are ban evidence only. Validate with: node tools/slop-detector/cli.mjs --validate-registry",
  "schema": 1,
  "tool": "chwezi-slop",
  "rules": [
    {
      "id": "banned-primary-font",
      "name": "Banned AI-slop font as primary type",
      "category": "slop",
      "as_overlay": "AS1",
      "severity": "block",
      "tier": "immediate",
      "engines": [
        "css",
        "scss",
        "html",
        "tailwind",
        "jsx",
        "py"
      ],
      "modes": [
        "persuade",
        "operate",
        "read",
        "experience"
      ],
      "doctrine_ref": "doctrine/references/ai-slop-banned-fonts.md#1-hard-ban-primary-offenders",
      "doctrine_markers": [
        "font.ban.hard.*",
        "font.ban.secondary.*",
        "font.ban.mono.*"
      ],
      "authority": {
        "human_authority": "Chwezi font doctrine: doctrine/references/ai-slop-banned-fonts.md (approvals trace to human design authority per pairing-principles.md)",
        "house_ruling": "Peter Bamuhigire, house rulings of 21 Jun 2026 and 29 Sep 2026 (Fraunces, IBM Plex); watchlist refresh 29 Sep 2026",
        "ban_evidence": [
          "impeccable@114ea1d:overused-font (evidence for bans only)"
        ]
      },
      "provenance": "Chwezi doctrine read from doctrine/references/ai-slop-banned-fonts.json through hooks/lib/font-matcher.js (shared with banned-font-gate.js). Impeccable list used as ban evidence only (Apache-2.0, commit 114ea1d).",
      "check": {
        "kind": "named",
        "name": "bannedPrimaryFont",
        "params": {
          "matcher_rule": "banned-primary-font"
        }
      },
      "exceptions": [
        "banned face named only as a fallback",
        "client brand guideline recorded as a waiver",
        "deliberate documented system-font fallback chain (system-font-fallbacks.md)"
      ],
      "fixtures": {
        "flag": "tests/fixtures/slop/banned-primary-font.flag.css",
        "pass": "tests/fixtures/slop/banned-primary-font.pass.css"
      }
    },
    {
      "id": "conditional-source-sans-primary",
      "name": "Source Sans as display or heading face",
      "category": "slop",
      "as_overlay": "AS1",
      "severity": "block",
      "tier": "immediate",
      "engines": [
        "css",
        "scss",
        "html",
        "tailwind",
        "jsx"
      ],
      "modes": [
        "persuade",
        "operate",
        "read",
        "experience"
      ],
      "doctrine_ref": "doctrine/references/ai-slop-banned-fonts.md#rule:font.conditional.source-sans-3",
      "doctrine_markers": [
        "font.conditional.*"
      ],
      "authority": {
        "human_authority": "Chwezi font doctrine §3 (Source Sans 3 permitted as a paired body face only)",
        "house_ruling": "Chwezi house rule, ai-slop-banned-fonts.md §3",
        "ban_evidence": []
      },
      "provenance": "Chwezi original rule (M10-09, 29 Sep 2026).",
      "check": {
        "kind": "named",
        "name": "bannedPrimaryFont",
        "params": {
          "matcher_rule": "conditional-source-sans-primary"
        }
      },
      "exceptions": [
        "Source Sans as a body face beneath a distinctive display face"
      ],
      "fixtures": {
        "flag": "tests/fixtures/slop/conditional-source-sans-primary.flag.css",
        "pass": "tests/fixtures/slop/conditional-source-sans-primary.pass.css"
      }
    },
    {
      "id": "flat-type-hierarchy",
      "name": "Flat type hierarchy",
      "category": "slop",
      "as_overlay": "AS1",
      "severity": "warning",
      "tier": "deep",
      "engines": [
        "css",
        "scss",
        "html",
        "tailwind",
        "jsx"
      ],
      "modes": [
        "persuade",
        "operate",
        "read",
        "experience"
      ],
      "doctrine_ref": "doctrine/references/type-scale-and-spacing.md#type-scale-use-a-real-ratio-not-arbitrary-sizes",
      "authority": {
        "human_authority": "Chwezi doctrine: governance/design-quality-gate.md Typography (type scale ratio >= 1.25)",
        "house_ruling": "",
        "ban_evidence": [
          "impeccable@114ea1d:flat-type-hierarchy"
        ]
      },
      "provenance": "Adapted in paraphrase from Impeccable (pbakaus/impeccable, Apache-2.0, https://github.com/pbakaus/impeccable, commit 114ea1d); no source or fixture copied.",
      "check": {
        "kind": "named",
        "name": "flatTypeHierarchy",
        "params": {
          "min_ratio": 1.25
        }
      },
      "exceptions": [],
      "fixtures": {
        "flag": "tests/fixtures/slop/flat-type-hierarchy.flag.css",
        "pass": "tests/fixtures/slop/flat-type-hierarchy.pass.css"
      }
    },
    {
      "id": "body-leading-tight",
      "name": "Body line-height below 1.5",
      "category": "slop",
      "as_overlay": "AS7",
      "severity": "warning",
      "tier": "deep",
      "engines": [
        "css",
        "scss",
        "html",
        "tailwind",
        "jsx"
      ],
      "modes": [
        "persuade",
        "operate",
        "read",
        "experience"
      ],
      "doctrine_ref": "doctrine/references/type-scale-and-spacing.md#line-height-inverse-to-size",
      "authority": {
        "human_authority": "Chwezi doctrine: governance/design-quality-gate.md Typography (inverse line-height rule); WCAG 2.2 SC 1.4.8 guidance (1.5 within paragraphs)",
        "house_ruling": "",
        "ban_evidence": [
          "impeccable@114ea1d:tight-leading"
        ]
      },
      "provenance": "Chwezi threshold 1.5 (stricter than Impeccable's 1.3). Adapted in paraphrase from Impeccable (pbakaus/impeccable, Apache-2.0, https://github.com/pbakaus/impeccable, commit 114ea1d); no source or fixture copied.",
      "check": {
        "kind": "named",
        "name": "leading",
        "params": {
          "min": 1.5
        }
      },
      "exceptions": [
        "headings and display type (inverse rule)"
      ],
      "fixtures": {
        "flag": "tests/fixtures/slop/body-leading-tight.flag.css",
        "pass": "tests/fixtures/slop/body-leading-tight.pass.css"
      }
    },
    {
      "id": "body-leading-loose",
      "name": "Body line-height above 1.9",
      "category": "slop",
      "as_overlay": "AS7",
      "severity": "warning",
      "tier": "deep",
      "engines": [
        "css",
        "scss",
        "html",
        "tailwind",
        "jsx"
      ],
      "modes": [
        "persuade",
        "operate",
        "read",
        "experience"
      ],
      "doctrine_ref": "doctrine/references/type-scale-and-spacing.md#line-height-inverse-to-size",
      "authority": {
        "human_authority": "Chwezi doctrine: governance/design-quality-gate.md Typography; website-skills slop-rules.md §11 (body line-height 1.5-1.9)",
        "house_ruling": "",
        "ban_evidence": []
      },
      "provenance": "Chwezi original rule (M10-09, 29 Sep 2026).",
      "check": {
        "kind": "named",
        "name": "leading",
        "params": {
          "max": 1.9
        }
      },
      "exceptions": [],
      "fixtures": {
        "flag": "tests/fixtures/slop/body-leading-loose.flag.css",
        "pass": "tests/fixtures/slop/body-leading-loose.pass.css"
      }
    },
    {
      "id": "heading-wide-tracking",
      "name": "Wide-tracked headings",
      "category": "slop",
      "as_overlay": "AS1",
      "severity": "warning",
      "tier": "deep",
      "engines": [
        "css",
        "scss",
        "html",
        "tailwind",
        "jsx"
      ],
      "modes": [
        "persuade",
        "operate",
        "read",
        "experience"
      ],
      "doctrine_ref": "doctrine/references/type-scale-and-spacing.md#letter-spacing-tracking",
      "authority": {
        "human_authority": "Chwezi doctrine: type-scale-and-spacing.md Letter-spacing; website-skills slop-rules.md §11 (heading letter-spacing above 0.04em fails)",
        "house_ruling": "",
        "ban_evidence": []
      },
      "provenance": "Chwezi original rule (M10-09, 29 Sep 2026).",
      "check": {
        "kind": "named",
        "name": "tracking",
        "params": {
          "scope": "heading",
          "max": 0.04
        }
      },
      "exceptions": [
        "uppercase or small-caps settings, which need added tracking"
      ],
      "fixtures": {
        "flag": "tests/fixtures/slop/heading-wide-tracking.flag.css",
        "pass": "tests/fixtures/slop/heading-wide-tracking.pass.css"
      }
    },
    {
      "id": "body-wide-tracking",
      "name": "Wide-tracked body text",
      "category": "slop",
      "as_overlay": "AS1",
      "severity": "advisory",
      "tier": "deep",
      "engines": [
        "css",
        "scss",
        "html",
        "tailwind",
        "jsx"
      ],
      "modes": [
        "persuade",
        "operate",
        "read",
        "experience"
      ],
      "doctrine_ref": "doctrine/references/type-scale-and-spacing.md#letter-spacing-tracking",
      "authority": {
        "human_authority": "Chwezi doctrine: governance/design-quality-gate.md Typography (body not wide-tracked)",
        "house_ruling": "",
        "ban_evidence": [
          "impeccable@114ea1d:wide-tracking"
        ]
      },
      "provenance": "Adapted in paraphrase from Impeccable (pbakaus/impeccable, Apache-2.0, https://github.com/pbakaus/impeccable, commit 114ea1d); no source or fixture copied.",
      "check": {
        "kind": "named",
        "name": "tracking",
        "params": {
          "scope": "body",
          "max": 0.05
        }
      },
      "exceptions": [
        "uppercase or small-caps settings"
      ],
      "fixtures": {